<?xml version="1.0" encoding="UTF-8"?>

<pillows xmlns="https://numen.yixin.im/schema/pillow"
		xmlns:xsi="http://www.w3.org/2001/XMLSchema-instance"
		xsi:schemaLocation="https://numen.yixin.im/schema/pillow https://numen.yixin.im/schema/pillow/pillow.xsd" >
	<pillow name="mypillow1" canExtends="false">
		<context>
			<context-param>
				<param-name>contextConfigLocation</param-name>
				<param-value>
					classpath*:test/conf/pillow-context.xml 
				</param-value>
			</context-param>
		</context>

		<servlet>
			<init-param>
				<param-name>contextConfigLocation</param-name>
				<param-value>classpath*:test/conf/pillow-dispatcher-servlet.xml</param-value>
			</init-param>
			<url-pattern>*.do</url-pattern>
		</servlet>
	</pillow>
	<pillow name="mypillow2"></pillow>
	
</pillows>